{
 "schema": "risk_spec",
 "version": "1.0",
 "taxonomy_version": "1.0",
 "scope": {
  "kind": "snap",
  "target_key": "snap:c3ff832377ee3e0bcdd66aa561bdfa33",
  "project_refs": [
   "e73c023a2e8e90349bb4d853730e1bfc"
  ],
  "ir_refs": [
   "c3ff832377ee3e0bcdd66aa561bdfa33"
  ],
  "diff_ref": null,
  "ir_hash": "2b05f03a9274122eb5ff1a8bf49def9b02c59923e996f3a2a9d59f2fcf6b142d"
 },
 "findings": [
  {
   "id": "F1",
   "direction": "risk",
   "domain": "mech",
   "mechanism": "interface",
   "mechanism_detail": "interference",
   "change_kind": "none",
   "subject": {
    "ckeys": [],
    "names": [
     "PLATE_2",
     "BRACKET_L"
    ]
   },
   "trigger_condition": "none",
   "severity": "중대",
   "judgement": "WARNING",
   "detectability": {
    "level": "sim-detectable",
    "tool": "list_interfaces"
   },
   "evidence_grade": "도구예측",
   "precedent": "none",
   "cites": [
    {
     "ref": "e:9a1f3c2b0d4e",
     "quote": "PLATE_2↔BRACKET_L interference penetration_depth≥0.05 mm(lower_bound) status=auto(미확정 초안)"
    }
   ],
   "tool_calls": [
    "list_interfaces(kind=interference)"
   ],
   "claim": "PLATE_2 와 BRACKET_L 사이 간섭이 auto 로 남아 있어 억지끼움 의도인지 확정되지 않았다.",
   "warrant": "penetration_depth 하한 0.05 mm 가 검출되었고 status=auto 다.",
   "resolving_check": {
    "kind": "tool",
    "ref": "set_interface 로 kind 확정 후 재스냅샷"
   },
   "owner_domain": "mech",
   "raised_by": [
    "mech-housing-structure"
   ],
   "contested_by": [],
   "contest_note": "",
   "status": "open"
  }
 ],
 "gains": [],
 "cross_domain": [],
 "character": {
  "one_liner": "3 리프 적층 시제 — 간섭 1건 미확정.",
  "facets": [
   {
    "facet": "intent",
    "statements": [],
    "na_reason": "좌석 미기재"
   },
   {
    "facet": "constraint",
    "statements": [],
    "na_reason": "좌석 미기재"
   },
   {
    "facet": "anomaly",
    "statements": [],
    "na_reason": "좌석 미기재"
   },
   {
    "facet": "lineage",
    "statements": [],
    "na_reason": "좌석 미기재"
   },
   {
    "facet": "vulnerability",
    "statements": [],
    "na_reason": "좌석 미기재"
   },
   {
    "facet": "strength",
    "statements": [],
    "na_reason": "좌석 미기재"
   },
   {
    "facet": "tradeoff",
    "statements": [],
    "na_reason": "좌석 미기재"
   },
   {
    "facet": "unknown",
    "statements": [],
    "na_reason": "좌석 미기재"
   }
  ]
 },
 "open_items": [],
 "coverage": {
  "seats": [
   {
    "key": "mech-housing-structure",
    "domain": "mech",
    "origin": "primary"
   }
  ],
  "domains_seated": [
   "mech"
  ],
  "domains_missing": [
   "xd",
   "sim",
   "cam",
   "rel",
   "soc",
   "disp",
   "pcb",
   "rf",
   "passive",
   "pwr",
   "sh",
   "mem",
   "std",
   "material"
  ]
 },
 "verdict": "undetermined",
 "verdict_conditions": [],
 "evidence_profile": {
  "tool": 1,
  "card": 0,
  "precedent": {
   "verified": 0,
   "dismissed": 0
  },
  "heuristic": 0,
  "measured": 0
 }
}
